{
  "$schema": "https://json-schema.org/draft/2020-12/schema",
  "$id": "https://bstbizera.github.io/biztrust_guide/schemas/next-actions.schema.json",
  "title": "badf/next-actions.json",
  "$comment": "Schema version 1.0.0. Derived from the record at main 6ba41e5 under BIZTRUST-GUIDE-WP-044. Exactly-one-primary and primary-names-an-existing-action are cross-record rules enforced by tests/test_badf_match_schemas.py, not here.",
  "type": "object",
  "additionalProperties": false,
  "required": ["schema_version", "project_id", "work_package_id", "updated_at", "actions"],
  "properties": {
    "schema_version": { "type": "string", "pattern": "^[0-9]+\\.[0-9]+\\.[0-9]+$" },
    "project_id": { "type": "string", "minLength": 1 },
    "work_package_id": { "type": "string", "pattern": "^BIZTRUST-GUIDE-WP-[0-9]{3}$" },
    "updated_at": { "type": "string", "format": "date-time" },
    "actions": {
      "type": "array",
      "minItems": 1,
      "items": {
        "type": "object",
        "additionalProperties": false,
        "required": ["id", "primary", "priority", "owner_role", "authority", "action", "prerequisites", "evidence_required", "stop_conditions", "fallback"],
        "properties": {
          "id": { "type": "string", "pattern": "^NS-[0-9]{3}$" },
          "primary": { "type": "boolean" },
          "priority": { "type": "integer" },
          "owner_role": { "type": "string", "minLength": 1 },
          "authority": { "type": "string", "minLength": 1 },
          "action": { "type": "string", "minLength": 1 },
          "prerequisites": { "type": "array", "items": { "type": "string", "minLength": 1 } },
          "evidence_required": { "type": "array", "items": { "type": "string", "minLength": 1 } },
          "stop_conditions": { "type": "array", "items": { "type": "string", "minLength": 1 } },
          "fallback": { "type": "string", "minLength": 1 }
        }
      }
    }
  }
}
