{
  "schema_version": "1.0.0",
  "project_id": "BIZTRUST-GUIDE",
  "work_package_id": "BIZTRUST-GUIDE-WP-061",
  "updated_at": "2026-09-06T03:51:40Z",
  "actions": [
    {
      "id": "NS-040",
      "primary": false,
      "priority": 1,
      "owner_role": "human-reviewer",
      "authority": "HUMAN_DECISION_REQUIRED",
      "action": "Issue #78, items 2 and 4: record a decision or explicit deferral for the four artifacts with no named producer and for the forty-one with no stated home. Items 1 and 3 were documented under WP-040 without deciding anything.",
      "prerequisites": [
        "A human reads issue #78"
      ],
      "evidence_required": [
        "An issue #78 comment per remaining item"
      ],
      "stop_conditions": [
        "An agent supplies either answer"
      ],
      "fallback": "Leave the catalogue's findings recorded, as they are now."
    },
    {
      "id": "NS-041",
      "primary": true,
      "priority": 2,
      "owner_role": "human-reviewer",
      "authority": "HUMAN_DECISION_REQUIRED",
      "action": "Wayfinder ticket #92: the operator posts one comment on issue #27 recording an explicit, expiring waiver of the one-slice-at-a-time rule so that ADR-001 to ADR-020 and the other v0.1 artifacts may be drafted as PROPOSED while S01 (#15) is open. All 24 drafting tickets on map #91 (#102 to #125) are blocked on #92, directly or transitively; #117 and #119 gained that edge during the WP-045 review, which found them wired to #15 and #94 only.",
      "prerequisites": [
        "A human with business or architecture authority reads #27 and #91"
      ],
      "evidence_required": [
        "A comment on #27 with no agent marker stating the waiver's scope, that nothing drafted is accepted, the expiry date and the operator's role",
        "#92 closed with a link to that comment"
      ],
      "stop_conditions": [
        "An agent posts the waiver, or a chat instruction is treated as the waiver (DEC-043)"
      ],
      "fallback": "The map's frontier stays at #92, #93 and #94; no ADR is drafted."
    },
    {
      "id": "NS-024",
      "primary": false,
      "priority": 3,
      "owner_role": "architecture-owner",
      "authority": "HUMAN_DECISION_REQUIRED",
      "action": "Answer the binding-authority question in issue #15, now wayfinder ticket #93 on map #91: send the ten-minute sheet from the #15 review comment to a placing broker for Tenant A (UniTrust) and Tenant B (the travel scheme), or answer as the tenant's principal, and record who answered, their role and the date. Does the entity ever commit an insurer to cover, or is every bind a request requiring separate insurer confirmation?",
      "prerequisites": [
        "Access to a practising broker or the UniTrust principals",
        "Map #91 Notes: conclusions and document digests only on GitHub; no agreements or licence numbers"
      ],
      "evidence_required": [
        "A written answer per tenant, recorded on #93 and then against the architecture contract",
        "#93 closed and #15 unblocked on its native blocked-by edge"
      ],
      "stop_conditions": [
        "The answer is assumed rather than obtained"
      ],
      "fallback": "Freeze nothing that depends on it, and record the dependency."
    },
    {
      "id": "NS-042",
      "primary": false,
      "priority": 4,
      "owner_role": "human-reviewer",
      "authority": "HUMAN_DECISION_REQUIRED",
      "action": "Wayfinder ticket #94: name the five review seats #27 requires - business authority, insurance practitioner, qualified Lao legal/compliance reviewer, broker finance reviewer, architecture owner - or record each unfilled seat with what would fill it and by when; and answer #15 suggestion 3, whether the practitioner seat must sign off any change touching cover state or money.",
      "prerequisites": [
        "A human reads #27's S01 entry requirements"
      ],
      "evidence_required": [
        "Five rows on #94, one per seat, filled or UNFILLED with a date",
        "#94 closed"
      ],
      "stop_conditions": [
        "An agent occupies or infers a seat"
      ],
      "fallback": "#15, ADR-014 (#117) and ADR-019 (#119) stay blocked on #94."
    },
    {
      "id": "NS-043",
      "primary": false,
      "priority": 5,
      "owner_role": "documentation-engineer",
      "authority": "OPERATOR_INSTRUCTION_2026_09_05_PROCEED_ON_YOUR_CALL_PROPOSED_ONLY",
      "action": "Work the P0 design map #128 one ticket per session, taking the first open, unblocked, unassigned child. Next is #147 the secrets-and-configuration design; #185 (P0.13 control-plane web) was added under WP-050 behind the security proof #148 and the tenant-mapping design #139. Of the epic designs, seven wait directly on an ADR ticket of map #91 and eleven transitively, #185 among them. Each design lands as PROPOSED under docs/architecture/p0/ by one Work Package PR after fresh-context review.",
      "prerequisites": [
        "docs/architecture/p0/README.md defines the template, naming and status rules (WP-046)",
        "For an ADR-gated epic design: its ADR ticket on map #91 is closed, which needs the #92 waiver (NS-041) first"
      ],
      "evidence_required": [
        "The ticket's resolution comment, the ticket closed, one line appended to #128 Decisions so far",
        "For a landed design: the PR's review record and badf/ re-anchored"
      ],
      "stop_conditions": [
        "A design says a capability is implemented, secure or compliant",
        "A design names a technology without an ADR row, or marks itself ACCEPTED",
        "Real client, policy, claim or premium data appears in an example"
      ],
      "fallback": "Leave the map's frontier as it stands; nothing on it is time-critical before BT-G0."
    },
    {
      "id": "NS-044",
      "primary": false,
      "priority": 6,
      "owner_role": "documentation-engineer",
      "authority": "OPERATOR_INSTRUCTION_2026_09_06_PROCEED_PROPOSED_ONLY",
      "action": "Work the Guide v2 map #153 one ticket per session: #155, #156, #157, #165 to #170 and #190 are resolved and the PLAN-001 rendering tickets (#155 to #157, #165 to #171, #190) have landed, #203 and #159 have landed, #160 is resolved by this branch, and #158, #208 and #211 remain. The frontier is #208 the NS numbering and #211 the Architect threat-model section; #158 doctrine waits on the #92 waiver. The showcase (#172 information architecture, then #173 to #180) stays the map's prototype tickets, one page per ticket after its record lands, as the map's Notes record; this track proposes, in a comment on #153, that the eight pages be collapsed through /to-spec after the record tickets close, and nothing changes until a comment on the map adopts it. The hub's v2.0-draft label stays until the map's destination is reached, the record tickets #158 to #160 and the showcase closed (DEC-061, superseding DEC-053's condition, which was met by finding under WP-058).",
      "prerequisites": [
        "PLAN-001 sections 0 to 15 (WP-048, WP-049), P0.13 (WP-050), the overview, four manuals, the operations page and the hub's roadmap on PLAN-001 (WP-051 to WP-057), the catalogue checked (WP-058)",
        "For #159 and #160: PLAN-001 sections 12 and 13 and the roadmap's sections 9 and 10"
      ],
      "evidence_required": [
        "The ticket's resolution comment, the ticket closed, one line appended to #153 Decisions so far",
        "For a landed record: the PR's review record, tests OK with the phase-page test still passing, badf/ re-anchored"
      ],
      "stop_conditions": [
        "A change to DELIVERY_PLAN.md v0.1's standing sections (1, 2, 8 to 11) without a ticket that carries them",
        "A record says a phase is accepted, authorised or implemented",
        "An identifier of the form P1.n, P2.n or P3.n is used with PLAN-001's meaning; those identifiers are the previous plan's and appear in PLAN-001 only in the 'was' and 'carries from' columns of sections 5, 6, 8 and 9"
      ],
      "fallback": "Leave every manual at its review head; the previous plan's retired text is in history at cf4eac1 and its standing sections are untouched."
    },
    {
      "id": "NS-033",
      "primary": false,
      "priority": 7,
      "owner_role": "documentation-engineer",
      "authority": "WAIT_FOR_AUTHORITY_ON_ASSERTED_KEYS_ISSUE_52",
      "action": "Reapply issue #52 item 3 as form (iii), DEC-033: computed.next_action.requires names, per fixture and in that fixture's own function, the observed.* and asserted.* keys the ACTION consumes; computed.freshness stays what the DERIVATION consumed and no sealed field moves. build.py reads the rule from the schema as it does for item 2.",
      "prerequisites": [
        "NS-034 merged as WP-033 (PR for issue #55)",
        "DEC-026 disposition 5: per action, no inherited global default, each dependency names an existing key, each fixture carries positive and negative tests for its own edge",
        "DEC-033: requires may name asserted.* as well as observed.* keys - a recorded departure from the letter of DEC-026 disposition 5 ('an existing observation'), which the operator is asked to confirm or refuse on issue #52 before this action starts; freshness is not rescoped to requires",
        "Schema amendment to 3.0.0: computed.next_action is additionalProperties false, so requires is a backward-incompatible addition that regenerates all nine fixtures, frozen HTML and manifests"
      ],
      "evidence_required": [
        "No requires value is assigned in build.py's base() or otherwise inherited; a test reads each fixture function's source and requires an explicit assignment in every function whose next_action is not null",
        "Every fixture carries a positive test naming its own expected edge and a negative test proving build.py --check refuses an edge naming a key that does not exist, and refuses an empty edge",